{
  "extensibility": "open",
  "fields": [
    {
      "applicability": {
        "product": "SitecoreAI",
        "profileId": "sitecore-ai.authoring.current",
        "surface": "authoring",
        "transport": "Data template field type names and authoring editors",
        "version": {
          "label": "SitecoreAI observed 2026-09-01",
          "mode": "rolling"
        }
      },
      "canonicalId": "sitecore-ai.authoring.current.Attachment",
      "claims": {
        "deliveryShape": {
          "evidence": [],
          "status": "undocumented",
          "value": null
        },
        "editorBehavior": {
          "evidence": [],
          "status": "undocumented",
          "value": null
        },
        "nativeType": {
          "evidence": [
            {
              "locator": "System field type table",
              "sourceId": "sitecore-ai.system-field-types"
            }
          ],
          "status": "documented",
          "value": "Attachment"
        },
        "storageShape": {
          "evidence": [],
          "status": "undocumented",
          "value": null
        },
        "typicalUse": {
          "evidence": [],
          "status": "undocumented",
          "value": null
        },
        "valueShape": {
          "evidence": [],
          "status": "undocumented",
          "value": null
        }
      },
      "formats": [],
      "nativeToken": "Attachment",
      "origin": "native",
      "renderingOperations": []
    },
    {
      "applicability": {
        "product": "SitecoreAI",
        "profileId": "sitecore-ai.authoring.current",
        "surface": "authoring",
        "transport": "Data template field type names and authoring editors",
        "version": {
          "label": "SitecoreAI observed 2026-09-01",
          "mode": "rolling"
        }
      },
      "canonicalId": "sitecore-ai.authoring.current.Checkbox",
      "claims": {
        "deliveryShape": {
          "evidence": [],
          "status": "undocumented",
          "value": null
        },
        "editorBehavior": {
          "evidence": [
            {
              "locator": "Data template field types and linked category pages",
              "sourceId": "sitecore-ai.field-types"
            }
          ],
          "status": "documented",
          "value": "Checkbox control."
        },
        "nativeType": {
          "evidence": [
            {
              "locator": "Simple, Link, and List field type sections",
              "sourceId": "sitecore-ai.simple-field-types"
            }
          ],
          "status": "documented",
          "value": "Checkbox"
        },
        "storageShape": {
          "evidence": [],
          "status": "undocumented",
          "value": null
        },
        "typicalUse": {
          "evidence": [
            {
              "locator": "Data template field types and linked category pages",
              "sourceId": "sitecore-ai.field-types"
            }
          ],
          "status": "documented",
          "value": "True/false authored choices."
        },
        "valueShape": {
          "evidence": [],
          "status": "undocumented",
          "value": null
        }
      },
      "formats": [],
      "nativeToken": "Checkbox",
      "origin": "native",
      "renderingOperations": []
    },
    {
      "applicability": {
        "product": "SitecoreAI",
        "profileId": "sitecore-ai.authoring.current",
        "surface": "authoring",
        "transport": "Data template field type names and authoring editors",
        "version": {
          "label": "SitecoreAI observed 2026-09-01",
          "mode": "rolling"
        }
      },
      "canonicalId": "sitecore-ai.authoring.current.Checklist",
      "claims": {
        "deliveryShape": {
          "evidence": [],
          "status": "undocumented",
          "value": null
        },
        "editorBehavior": {
          "evidence": [],
          "status": "undocumented",
          "value": null
        },
        "nativeType": {
          "evidence": [
            {
              "locator": "Simple, Link, and List field type sections",
              "sourceId": "sitecore-ai.simple-field-types"
            },
            {
              "locator": "List field type table",
              "sourceId": "sitecore-ai.list-field-types"
            }
          ],
          "status": "documented",
          "value": "Checklist"
        },
        "storageShape": {
          "evidence": [],
          "status": "undocumented",
          "value": null
        },
        "typicalUse": {
          "evidence": [],
          "status": "undocumented",
          "value": null
        },
        "valueShape": {
          "evidence": [],
          "status": "undocumented",
          "value": null
        }
      },
      "formats": [],
      "nativeToken": "Checklist",
      "origin": "native",
      "renderingOperations": []
    },
    {
      "applicability": {
        "product": "SitecoreAI",
        "profileId": "sitecore-ai.authoring.current",
        "surface": "authoring",
        "transport": "Data template field type names and authoring editors",
        "version": {
          "label": "SitecoreAI observed 2026-09-01",
          "mode": "rolling"
        }
      },
      "canonicalId": "sitecore-ai.authoring.current.Date",
      "claims": {
        "deliveryShape": {
          "evidence": [],
          "status": "undocumented",
          "value": null
        },
        "editorBehavior": {
          "evidence": [
            {
              "locator": "Data template field types and linked category pages",
              "sourceId": "sitecore-ai.field-types"
            }
          ],
          "status": "documented",
          "value": "Date input."
        },
        "nativeType": {
          "evidence": [
            {
              "locator": "Simple, Link, and List field type sections",
              "sourceId": "sitecore-ai.simple-field-types"
            }
          ],
          "status": "documented",
          "value": "Date"
        },
        "storageShape": {
          "evidence": [],
          "status": "undocumented",
          "value": null
        },
        "typicalUse": {
          "evidence": [
            {
              "locator": "Data template field types and linked category pages",
              "sourceId": "sitecore-ai.field-types"
            }
          ],
          "status": "documented",
          "value": "Date values."
        },
        "valueShape": {
          "evidence": [],
          "status": "undocumented",
          "value": null
        }
      },
      "formats": [],
      "nativeToken": "Date",
      "origin": "native",
      "renderingOperations": []
    },
    {
      "applicability": {
        "product": "SitecoreAI",
        "profileId": "sitecore-ai.authoring.current",
        "surface": "authoring",
        "transport": "Data template field type names and authoring editors",
        "version": {
          "label": "SitecoreAI observed 2026-09-01",
          "mode": "rolling"
        }
      },
      "canonicalId": "sitecore-ai.authoring.current.Datetime",
      "claims": {
        "deliveryShape": {
          "evidence": [],
          "status": "undocumented",
          "value": null
        },
        "editorBehavior": {
          "evidence": [
            {
              "locator": "Data template field types and linked category pages",
              "sourceId": "sitecore-ai.field-types"
            }
          ],
          "status": "documented",
          "value": "Date-time input."
        },
        "nativeType": {
          "evidence": [
            {
              "locator": "Simple, Link, and List field type sections",
              "sourceId": "sitecore-ai.simple-field-types"
            }
          ],
          "status": "documented",
          "value": "Datetime"
        },
        "storageShape": {
          "evidence": [],
          "status": "undocumented",
          "value": null
        },
        "typicalUse": {
          "evidence": [
            {
              "locator": "Data template field types and linked category pages",
              "sourceId": "sitecore-ai.field-types"
            }
          ],
          "status": "documented",
          "value": "Date and time values."
        },
        "valueShape": {
          "evidence": [],
          "status": "undocumented",
          "value": null
        }
      },
      "formats": [],
      "nativeToken": "Datetime",
      "origin": "native",
      "renderingOperations": []
    },
    {
      "applicability": {
        "product": "SitecoreAI",
        "profileId": "sitecore-ai.authoring.current",
        "surface": "authoring",
        "transport": "Data template field type names and authoring editors",
        "version": {
          "label": "SitecoreAI observed 2026-09-01",
          "mode": "rolling"
        }
      },
      "canonicalId": "sitecore-ai.authoring.current.Droplink",
      "claims": {
        "deliveryShape": {
          "evidence": [],
          "status": "undocumented",
          "value": null
        },
        "editorBehavior": {
          "evidence": [
            {
              "locator": "Data template field types and linked category pages",
              "sourceId": "sitecore-ai.field-types"
            }
          ],
          "status": "documented",
          "value": "Single-item drop-link selector."
        },
        "nativeType": {
          "evidence": [
            {
              "locator": "Simple, Link, and List field type sections",
              "sourceId": "sitecore-ai.simple-field-types"
            },
            {
              "locator": "Link field type table",
              "sourceId": "sitecore-ai.link-field-types"
            }
          ],
          "status": "documented",
          "value": "Droplink"
        },
        "storageShape": {
          "evidence": [],
          "status": "undocumented",